"id","type_species","species","author","subspecies","common_name","higher_taxa","species_number","changes","description","created_at","updated_at"
11235,0,"Varanus gouldii","(GRAY 1838)","","E: Sand Monitor, Gould's Goanna
G: Gouldswaran","Varanidae, Platynota, Varanoidea, Anguimorpha, Sauria, Squamata (lizards)",19920,"",NULL,"2021-04-30 18:54:01","2021-04-30 18:54:01"
11234,0,"Varanus glebopalma","MITCHELL 1955","","E: Black-palmed Rock Monitor, Long-Tailed Rock Monitor","Varanidae, Platynota, Varanoidea, Anguimorpha, Sauria, Squamata (lizards)",19919,"",NULL,"2021-04-30 18:54:01","2021-04-30 18:54:01"
11233,0,"Varanus glauerti","MERTENS 1957","","E: Kimberley Rock Monitor
G: Kimberley-Felsenwaran","Varanidae, Platynota, Varanoidea, Anguimorpha, Sauria, Squamata (lizards)",19918,"",NULL,"2021-04-30 18:54:01","2021-04-30 18:54:01"
11232,0,"Varanus gilleni","LUCAS & FROST 1895","","E: Pygmy Mulga Monitor
G: Gillens Zwergwaran","Varanidae, Platynota, Varanoidea, Anguimorpha, Sauria, Squamata (lizards)",19917,"",NULL,"2021-04-30 18:54:01","2021-04-30 18:54:01"
11231,0,"Varanus giganteus","(GRAY 1845)","","E: Perentie","Varanidae, Platynota, Varanoidea, Anguimorpha, Sauria, Squamata (lizards)",19916,"",NULL,"2021-04-30 18:54:01","2021-04-30 18:54:01"
11230,0,"Varanus flavescens","(HARDWICKE & GRAY 1827)","","E: Yellow Monitor
G: Gelbwaran","Varanidae, Platynota, Varanoidea, Anguimorpha, Sauria, Squamata (lizards)",19915,"",NULL,"2021-04-30 18:54:01","2021-04-30 18:54:01"
11229,0,"Varanus finschi","BÖHME, HORN & ZIEGLER 1994","","","Varanidae, Platynota, Varanoidea, Anguimorpha, Sauria, Squamata (lizards)",19914,"",NULL,"2021-04-30 18:54:01","2021-04-30 18:54:01"
11228,0,"Varanus exanthematicus","(BOSC 1792)","","E: Savannah Monitor
G: Steppenwaran","Varanidae, Platynota, Varanoidea, Anguimorpha, Sauria, Squamata (lizards)",19913,"",NULL,"2021-04-30 18:54:01","2021-04-30 18:54:01"
11227,0,"Varanus eremius","LUCAS & FROST 1895","","E: Rusty Desert Monitor","Varanidae, Platynota, Varanoidea, Anguimorpha, Sauria, Squamata (lizards)",19912,"",NULL,"2021-04-30 18:54:01","2021-04-30 18:54:01"
11226,0,"Varanus dumerilii","SCHLEGEL 1839","","E: Dumeril Monitor
G: Dumerilwaran","Varanidae, Platynota, Varanoidea, Anguimorpha, Sauria, Squamata (lizards)",19911,"",NULL,"2021-04-30 18:54:01","2021-04-30 18:54:01"
11225,0,"Varanus douarrha","(LESSON 1830)","","E: New Ireland Monitor
G: Neu-Irland-Waran","Varanidae, Platynota, Varanoidea, Anguimorpha, Sauria, Squamata (lizards)",20951,"",NULL,"2021-04-30 18:54:01","2021-04-30 18:54:01"
11224,0,"Varanus doreanus","(MEYER 1874)","","E: Bluetail Monitor","Varanidae, Platynota, Varanoidea, Anguimorpha, Sauria, Squamata (lizards)",19910,"",NULL,"2021-04-30 18:54:01","2021-04-30 18:54:01"
11223,0,"Varanus dalubhasa","WELTON, TRAVERS, SILER & BROWN 2014","","E: Enteng’s Monitor Lizard","Varanidae, Platynota, Varanoidea, Anguimorpha, Sauria, Squamata (lizards)",19909,"",NULL,"2021-04-30 18:54:01","2021-04-30 18:54:01"
11222,0,"Varanus cumingi","MARTIN 1839","","E: Cuming’s water monitor","Varanidae, Platynota, Varanoidea, Anguimorpha, Sauria, Squamata (lizards)",19908,"",NULL,"2021-04-30 18:54:01","2021-04-30 18:54:01"
11221,0,"Varanus colei","BÖHME, JACOBS, KOPPETSCH & SCHMITZ 2019","","","Varanidae, Platynota, Varanoidea, Anguimorpha, Sauria, Squamata (lizards)",22418,"",NULL,"2021-04-30 18:54:01","2021-04-30 18:54:01"
11220,0,"Varanus cerambonensis","PHILIPP, BÖHME & ZIEGLER 1999","","","Varanidae, Platynota, Varanoidea, Anguimorpha, Sauria, Squamata (lizards)",19907,"",NULL,"2021-04-30 18:54:01","2021-04-30 18:54:01"
11219,0,"Varanus caudolineatus","BOULENGER 1885","","E: Line-tailed Pygmy Monitor
G: Streifenschwanzwaran","Varanidae, Platynota, Varanoidea, Anguimorpha, Sauria, Squamata (lizards)",19906,"",NULL,"2021-04-30 18:54:01","2021-04-30 18:54:01"
11218,0,"Varanus caerulivirens","ZIEGLER, BÖHME & PHILIPP 1999","","E: Turquoise Monitor","Varanidae, Platynota, Varanoidea, Anguimorpha, Sauria, Squamata (lizards)",19905,"",NULL,"2021-04-30 18:54:01","2021-04-30 18:54:01"
11217,0,"Varanus bushi","APLIN, FITCH & KING 2006","","E: Pilbara Mulga Goanna","Varanidae, Platynota, Varanoidea, Anguimorpha, Sauria, Squamata (lizards)",19904,"",NULL,"2021-04-30 18:54:01","2021-04-30 18:54:01"
11216,0,"Varanus brevicauda","BOULENGER 1898","","E: Short-tailed Pygmy Monitor
G: Kurzschwanzwaran","Varanidae, Platynota, Varanoidea, Anguimorpha, Sauria, Squamata (lizards)",19903,"",NULL,"2021-04-30 18:54:01","2021-04-30 18:54:01"
11215,0,"Varanus bogerti","MERTENS 1950","","E: Bogert's Monitor
G: Bogerts Waran","Varanidae, Platynota, Varanoidea, Anguimorpha, Sauria, Squamata (lizards)",19902,"",NULL,"2021-04-30 18:54:01","2021-04-30 18:54:01"
11214,0,"Varanus boehmei","JACOBS 2003","","","Varanidae, Platynota, Varanoidea, Anguimorpha, Sauria, Squamata (lizards)",19901,"",NULL,"2021-04-30 18:54:01","2021-04-30 18:54:01"
11213,0,"Varanus bitatawa","WELTON, SILER, BENNETT, DIESMOS, RUYA, DUGAY, RICO, VAN WEERD & BROWN 2010","","E: Sierra Madre forest monitor","Varanidae, Platynota, Varanoidea, Anguimorpha, Sauria, Squamata (lizards)",19900,"",NULL,"2021-04-30 18:54:01","2021-04-30 18:54:01"
11212,0,"Varanus bennetti","WEIJOLA, VAHTERA, KOCH, SCHMITZ & KRAUS 2020","","E: Bennett’s long-tailed monitor","Varanidae, Platynota, Varanoidea, Anguimorpha, Sauria, Squamata (lizards)",22907,"",NULL,"2021-04-30 18:54:01","2021-04-30 18:54:01"
11211,0,"Varanus bengalensis","(DAUDIN 1802)","Varanus bengalensis bengalensis (DAUDIN 1802)
Varanus bengalensis irrawadicus YANG & LI 1987","E: Bengal Monitor, Indian Monitor
G: Bengalwaran
Chinese: 孟加拉巨蜥","Varanidae, Platynota, Varanoidea, Anguimorpha, Sauria, Squamata (lizards)",19899,"",NULL,"2021-04-30 18:54:01","2021-04-30 18:54:01"
11210,0,"Varanus beccarii","(DORIA 1874)","","E: Black Tree Monitor
G: Schwarzer Baumwaran, Schwarzer Smaragdwaran","Varanidae, Platynota, Varanoidea, Anguimorpha, Sauria, Squamata (lizards)",19898,"",NULL,"2021-04-30 18:54:01","2021-04-30 18:54:01"
11209,0,"Varanus baritji","KING & HORNER 1987","","E: Black-spotted Ridge-tailed Monitor, Black-spotted Spiny-tailed Monitor","Varanidae, Platynota, Varanoidea, Anguimorpha, Sauria, Squamata (lizards)",19897,"",NULL,"2021-04-30 18:54:01","2021-04-30 18:54:01"
11208,0,"Varanus bangonorum","WELTON, TRAVERS, SILER & BROWN 2014","","E: Bangon Monitor Lizard","Varanidae, Platynota, Varanoidea, Anguimorpha, Sauria, Squamata (lizards)",19896,"",NULL,"2021-04-30 18:54:01","2021-04-30 18:54:01"
11207,0,"Varanus auffenbergi","SPRACKLAND 1999","","G: Auffenbergs Waran
E: Auffenberg’s Monitor, Pin-spot monitor, Peacock monitor","Varanidae, Platynota, Varanoidea, Anguimorpha, Sauria, Squamata (lizards)",19895,"",NULL,"2021-04-30 18:54:01","2021-04-30 18:54:01"
11206,0,"Varanus albigularis","DAUDIN 1802","Varanus albigularis albigularis DAUDIN 1802
Varanus albigularis angolensis SCHMIDT 1933
Varanus albigularis microstictus BOETTGER 1893","E: White-throated Monitor, Rock monitor
G: Kapwaran, Weißkehlwaran","Varanidae, Platynota, Varanoidea, Anguimorpha, Sauria, Squamata (lizards)",19894,"",NULL,"2021-04-30 18:54:01","2021-04-30 18:54:01"
11205,0,"Varanus acanthurus","BOULENGER 1885","Varanus acanthurus acanthurus BOULENGER 1885
Varanus acanthurus brachyurus STERNFELD 1919
Varanus acanthurus insulanicus MERTENS 1958","E: Ridgetail Monitor
G: (Roter) Stachelschwanzwaran","Varanidae, Platynota, Varanoidea, Anguimorpha, Sauria, Squamata (lizards)",19893,"",NULL,"2021-04-30 18:54:00","2021-04-30 18:54:00"
11204,0,"Vanzosaura savanicola","RECODER, WERNECK, TEXEIRA JR, COLLI, SITES & RODRIGUES 2014","","","Gymnophthalmidae (Gymnophthalminae), Gymnophthalmini, Sauria, Gymnophthalmoidea, Squamata (lizards)",19892,"",NULL,"2021-04-30 18:54:00","2021-04-30 18:54:00"
11203,1,"Vanzosaura rubricauda","(BOULENGER 1902)","","E: Red-tailed vanzosaur","Gymnophthalmidae (Gymnophthalminae), Gymnophthalmini, Sauria, Gymnophthalmoidea, Squamata (lizards)",19891,"",NULL,"2021-04-30 18:54:00","2021-04-30 18:54:00"
11202,0,"Vanzosaura multiscutata","(AMARAL 1933)","","","Gymnophthalmidae (Gymnophthalminae), Gymnophthalmini, Sauria, Gymnophthalmoidea, Squamata (lizards)",19890,"",NULL,"2021-04-30 18:54:00","2021-04-30 18:54:00"
11201,1,"Uvidicolus sphyrurus","(OGILBY 1892)","","E: Border Thick-tailed Gecko","Carphodactylidae, Gekkota, Sauria, Squamata (lizards: geckos)",19889,"",NULL,"2021-04-30 18:54:00","2021-04-30 18:54:00"
11200,0,"Uta tumidarostra","GRISMER 1994","","E: Swollen-nosed Side-blotched Lizard
S: Mancha lateral Narigona","Phrynosomatidae, Sceloporinae; Iguania, Sauria, Squamata (lizards)",19888,"",NULL,"2021-04-30 18:54:00","2021-04-30 18:54:00"
11199,1,"Uta stansburiana","BAIRD & GIRARD 1852","Uta stansburiana elegans YARROW 1882
Uta stansburiana martinensis VAN DENBURGH 1905
Uta stansburiana nevadensis RUTHVEN 1913
Uta stansburiana stansburiana BAIRD & GIRARD 1852
Uta stansburiana stejnegeri SCHMIDT 1921
Uta stansburiana taylori SMITH 1935
Uta stansburiana uniformis PACK & TANNER 1970","Side-blotched Lizard
elegans: Western or California Side-blotched Lizard
nevadensis: Nevada Side-blotched Lizard
stansburiana: Northern Side-blotched Lizard
stejnegeri: Desert Side-blotched Lizard, Eastern Side-blotched Lizard
taylori:
uniformis: Colorado Side-blotched Lizard
concinna: Dickerson's Side-blotched Lizard
S: Mancha lateral Común ","Phrynosomatidae, Sceloporinae; Iguania, Sauria, Squamata (lizards)",19887,"",NULL,"2021-04-30 18:54:00","2021-04-30 18:54:00"
11198,0,"Uta squamata","DICKERSON 1919","","E: Isla Santa Catalina Side-blotched Lizard
S: Mancha lateral Santa Catalina","Phrynosomatidae, Sceloporinae; Iguania, Sauria, Squamata (lizards)",19886,"",NULL,"2021-04-30 18:54:00","2021-04-30 18:54:00"
11197,0,"Uta palmeri","STEJNEGER 1890","","E: San Pedro Side-blotched Lizard
S: Mancha lateral de San Pedro Martir","Phrynosomatidae, Sceloporinae; Iguania, Sauria, Squamata (lizards)",19885,"",NULL,"2021-04-30 18:54:00","2021-04-30 18:54:00"
11196,0,"Uta nolascensis","VAN DENBURGH & SLEVIN 1921","","E: Isla San Pedro Nolasco Lizard
S: Mancha lateral de San Pedro Nolasco","Phrynosomatidae, Sceloporinae; Iguania, Sauria, Squamata (lizards)",19884,"",NULL,"2021-04-30 18:54:00","2021-04-30 18:54:00"
11195,0,"Uta lowei","GRISMER 1994","","E: Dead Side-blotched Lizard
S: Mancha lateral Muerta","Phrynosomatidae, Sceloporinae; Iguania, Sauria, Squamata (lizards)",19883,"",NULL,"2021-04-30 18:54:00","2021-04-30 18:54:00"
11194,0,"Uta encantadae","GRISMER 1994","","E: San Lorenzo Island Lizard
S: Mancha lateral Encantadas","Phrynosomatidae, Sceloporinae; Iguania, Sauria, Squamata (lizards)",19882,"",NULL,"2021-04-30 18:54:00","2021-04-30 18:54:00"
11193,0,"Urotheca pachyura","(COPE 1875)","","","Colubridae (Dipsadinae), Colubroidea, Caenophidia, Alethinophidia, Serpentes, Squamata (snakes)",19881,"",NULL,"2021-04-30 18:54:00","2021-04-30 18:54:00"
11192,0,"Urotheca myersi","SAVAGE & LAHANAS 1989","","","Colubridae (Dipsadinae), Colubroidea, Caenophidia, Alethinophidia, Serpentes, Squamata (snakes)",19880,"",NULL,"2021-04-30 18:54:00","2021-04-30 18:54:00"
11191,0,"Urotheca multilineata","(PETERS 1863)","","","Colubridae (Dipsadinae), Colubroidea, Caenophidia, Alethinophidia, Serpentes, Squamata (snakes)",19879,"",NULL,"2021-04-30 18:54:00","2021-04-30 18:54:00"
11190,0,"Urotheca lateristriga","(BERTHOLD 1859)","","S: Culebra de labios manchados","Colubridae (Dipsadinae), Colubroidea, Caenophidia, Alethinophidia, Serpentes, Squamata (snakes)",19878,"",NULL,"2021-04-30 18:54:00","2021-04-30 18:54:00"
11189,0,"Urotheca guentheri","(DUNN 1938)","","E: Striped glasstail","Colubridae (Dipsadinae), Colubroidea, Caenophidia, Alethinophidia, Serpentes, Squamata (snakes)",19877,"",NULL,"2021-04-30 18:54:00","2021-04-30 18:54:00"
11188,0,"Urotheca fulviceps","(COPE 1886)","","","Colubridae (Dipsadinae), Colubroidea, Caenophidia, Alethinophidia, Serpentes, Squamata (snakes)",19876,"",NULL,"2021-04-30 18:54:00","2021-04-30 18:54:00"
11187,1,"Urotheca dumerilli","(BIBRON 1840)","","","Colubridae (Dipsadinae), Colubroidea, Caenophidia, Alethinophidia, Serpentes, Squamata (snakes)",19875,"",NULL,"2021-04-30 18:54:00","2021-04-30 18:54:00"
11186,0,"Urotheca decipiens","(GÜNTHER 1893)","","E: Pale Ground Snake","Colubridae (Dipsadinae), Colubroidea, Caenophidia, Alethinophidia, Serpentes, Squamata (snakes)",19874,"",NULL,"2021-04-30 18:54:00","2021-04-30 18:54:00"
11185,1,"Urostrophus vautieri","DUMÉRIL & BIBRON 1837","","E: Brazilian Steppe Iguana","Leiosauridae (Enyaliinae), Iguania, Sauria, Squamata (lizards)",19873,"",NULL,"2021-04-30 18:54:00","2021-04-30 18:54:00"
11184,0,"Urostrophus gallardoi","ETHERIDGE & WILLIAMS 1991","","","Leiosauridae (Enyaliinae), Iguania, Sauria, Squamata (lizards)",19872,"",NULL,"2021-04-30 18:54:00","2021-04-30 18:54:00"
11183,0,"Urosaurus ornatus","(BAIRD & GIRARD 1852)","Urosaurus ornatus ornatus (BAIRD & GIRARD 1852)
Urosaurus ornatus caeruleus (SMITH 1935)
Urosaurus ornatus chiricahuae (MITTLEMAN 1941)
Urosaurus ornatus lateralis (BOULENGER 1883)
Urosaurus ornatus levis (STEJNEGER 1890)
Urosaurus ornatus linearis (BAIRD 1859)
Urosaurus ornatus schmidti (MITTLEMAN 1940)
Urosaurus ornatus schottii (BAIRD 1859)
Urosaurus ornatus symmetricus (BAIRD 1859)
Urosaurus ornatus wrighti (SCHMIDT 1921)","Tree Lizard
levis: Smooth Tree Lizard
schmidti: Big Bend Tree Lizard
schottii: Schott’s Tree Lizard
symmetricus: Colorado River Tree Lizard
S: Roñito Ornado","Phrynosomatidae, Sceloporinae; Iguania, Sauria, Squamata (lizards)",19871,"",NULL,"2021-04-30 18:54:00","2021-04-30 18:54:00"
11182,0,"Urosaurus nigricaudus","(COPE 1864)","","E: Small-scaled Lizard [microscutatus]
S: Roñito de Matorral Cola-negra","Phrynosomatidae, Sceloporinae; Iguania, Sauria, Squamata (lizards)",19870,"",NULL,"2021-04-30 18:54:00","2021-04-30 18:54:00"
11181,0,"Urosaurus lahtelai","RAU & LOOMIS 1977","","E: Baja California Brush Lizard
S: Roñito de Matorral Bajacaliforniano","Phrynosomatidae, Sceloporinae; Iguania, Sauria, Squamata (lizards)",19869,"",NULL,"2021-04-30 18:54:00","2021-04-30 18:54:00"
11180,1,"Urosaurus graciosus","HALLOWELL 1854","Urosaurus graciosus graciosus HALLOWELL 1854
Urosaurus graciosus shannoni LOWE 1955","E: Western Long-tailed Brush Lizard [graciosus]
E: Arizona Long-tailed Brush Lizard [shannoni]
S: Roñito de Matorral","Phrynosomatidae, Sceloporinae; Iguania, Sauria, Squamata (lizards)",19867,"",NULL,"2021-04-30 18:54:00","2021-04-30 18:54:00"
11179,0,"Urosaurus gadovi","SCHMIDT 1921","","E: Gadow's Tree Lizard
S: Arboricola de Gadow","Phrynosomatidae, Sceloporinae; Iguania, Sauria, Squamata (lizards)",19866,"",NULL,"2021-04-30 18:54:00","2021-04-30 18:54:00"
11178,0,"Urosaurus clarionensis","(TOWNSEND 1890)","","E: Clarion Island Tree Lizard
S: Arboricola de Isla Clarion","Phrynosomatidae, Sceloporinae; Iguania, Sauria, Squamata (lizards)",19865,"",NULL,"2021-04-30 18:54:00","2021-04-30 18:54:00"
11177,0,"Urosaurus bicarinatus","(DUMÉRIL 1856)","Urosaurus bicarinatus bicarinatus (DUMÉRIL 1856)
Urosaurus bicarinatus anonymorphus (MITTLEMAN 1941)
Urosaurus bicarinatus nelsoni (SCHMIDT 1921)
Urosaurus bicarinatus spinosus BUMZAHEM & SMITH 1954
Urosaurus bicarinatus tuberculatus (SCHMIDT 1921)","E: Tropical tree lizard
S: Roñito Arboricola","Phrynosomatidae, Sceloporinae; Iguania, Sauria, Squamata (lizards)",19864,"",NULL,"2021-04-30 18:54:00","2021-04-30 18:54:00"
11176,0,"Urosaurus auriculatus","(COPE 1871)","","E: Socorro Island Tree Lizard
S: Arboricola de Isla Socorro","Phrynosomatidae, Sceloporinae; Iguania, Sauria, Squamata (lizards)",19863,"",NULL,"2021-04-30 18:54:00","2021-04-30 18:54:00"
11175,0,"Uroplatus sikorae","BOETTGER 1913","","E: Southern Flat-tail Gecko, mossy leaf-tail gecko","Gekkonidae, Gekkota, Sauria, Squamata (lizards: geckos)",19862,"",NULL,"2021-04-30 18:54:00","2021-04-30 18:54:00"
11174,0,"Uroplatus sameiti","BÖHME & IBISCH 1990","","","Gekkonidae, Gekkota, Sauria, Squamata (lizards: geckos)",19861,"",NULL,"2021-04-30 18:54:00","2021-04-30 18:54:00"
11173,0,"Uroplatus pietschmanni","BÖHLE & SCHÖNECKER 2004","","E: Spiny Leaf-tailed Gecko, cork-bark leaf-tail gecko","Gekkonidae, Gekkota, Sauria, Squamata (lizards: geckos)",19860,"",NULL,"2021-04-30 18:54:00","2021-04-30 18:54:00"
11172,0,"Uroplatus phantasticus","(BOULENGER 1888)","","E: Satanic leaf-tailed gecko, Phantastic leaf-tailed gecko","Gekkonidae, Gekkota, Sauria, Squamata (lizards: geckos)",19859,"",NULL,"2021-04-30 18:54:00","2021-04-30 18:54:00"
11171,0,"Uroplatus malama","NUSSBAUM & RAXWORTHY 1995","","","Gekkonidae, Gekkota, Sauria, Squamata (lizards: geckos)",19858,"",NULL,"2021-04-30 18:54:00","2021-04-30 18:54:00"
11170,0,"Uroplatus malahelo","NUSSBAUM & RAXWORTHY 1994","","","Gekkonidae, Gekkota, Sauria, Squamata (lizards: geckos)",19857,"",NULL,"2021-04-30 18:54:00","2021-04-30 18:54:00"
11169,0,"Uroplatus lineatus","(DUMÉRIL & BIBRON 1836)","","E: Lined Flat-tail Gecko","Gekkonidae, Gekkota, Sauria, Squamata (lizards: geckos)",19856,"",NULL,"2021-04-30 18:54:00","2021-04-30 18:54:00"
11168,0,"Uroplatus kelirambo","RATSOAVINA, GEHRING, SCHERZ, VIEITES, GLAW & VENCES 2017","","","Gekkonidae, Gekkota, Sauria, Squamata (lizards: geckos)",20954,"",NULL,"2021-04-30 18:54:00","2021-04-30 18:54:00"
11167,0,"Uroplatus henkeli","BÖHME & IBISCH 1990","","E: Henkel’s Flat-tail gecko, Henkel’s leaf-tailed gecko, frilled leaf-tail gecko","Gekkonidae, Gekkota, Sauria, Squamata (lizards: geckos)",19855,"",NULL,"2021-04-30 18:54:00","2021-04-30 18:54:00"
11166,0,"Uroplatus guentheri","MOCQUARD 1908","","E: Gunther's FIat-tail Gecko
G: Günthers Plattschwanzgecko","Gekkonidae, Gekkota, Sauria, Squamata (lizards: geckos)",19854,"",NULL,"2021-04-30 18:54:00","2021-04-30 18:54:00"
11165,0,"Uroplatus giganteus","GLAW, KOSUCH, HENKEL, SOUND & BÖHME 2006","","E: giant leaf-tail gecko
G: Riesenplattschwanzgecko","Gekkonidae, Gekkota, Sauria, Squamata (lizards: geckos)",19853,"",NULL,"2021-04-30 18:54:00","2021-04-30 18:54:00"
11164,0,"Uroplatus fotsivava","RATSOAVINA, GEHRING, SCHERZ, VIEITES, GLAW & VENCES 2017","","","Gekkonidae, Gekkota, Sauria, Squamata (lizards: geckos)",21122,"",NULL,"2021-04-30 18:54:00","2021-04-30 18:54:00"
11163,0,"Uroplatus finiavana","RATSOAVINA, LOUIS JR., CROTTINI, RANDRIANIAINA, GLAW & VENCES 2011","","","Gekkonidae, Gekkota, Sauria, Squamata (lizards: geckos)",19852,"",NULL,"2021-04-30 18:54:00","2021-04-30 18:54:00"
11162,0,"Uroplatus finaritra","RATSOAVINA, RASELIMANANA, SCHERZ, RAKOTOARISON, RAZAFINDRAIBE, GLAW & VENCES 2019","","","Gekkonidae, Gekkota, Sauria, Squamata (lizards: geckos)",21789,"",NULL,"2021-04-30 18:54:00","2021-04-30 18:54:00"
11161,1,"Uroplatus fimbriatus","(SCHNEIDER 1797)","","E: Common Flat-tail Gecko
G: Plattschwanzgecko","Gekkonidae, Gekkota, Sauria, Squamata (lizards: geckos)",19851,"",NULL,"2021-04-30 18:54:00","2021-04-30 18:54:00"
11160,0,"Uroplatus fiera","RATSOAVINA, RANJANAHARISOA, GLAW, RASELIMANANA, MIRALLES & VENCES 2015","","","Gekkonidae, Gekkota, Sauria, Squamata (lizards: geckos)",20325,"",NULL,"2021-04-30 18:54:00","2021-04-30 18:54:00"
11159,0,"Uroplatus fetsy","RATSOAVINA, SCHERZ, TOLLEY, RASELIMANANA, GLAW & VENCES 2019","","","Gekkonidae, Gekkota, Sauria, Squamata (lizards: geckos)",22409,"",NULL,"2021-04-30 18:54:00","2021-04-30 18:54:00"
11158,0,"Uroplatus ebenaui","(BOETTGER 1879)","","E: Nosy Be FIat-tail Gecko, spearpoint leaf-tail gecko","Gekkonidae, Gekkota, Sauria, Squamata (lizards: geckos)",19850,"",NULL,"2021-04-30 18:54:00","2021-04-30 18:54:00"
11157,0,"Uroplatus alluaudi","MOCQUARD 1894","","E: Northern Flat-tail Gecko, northern leaf-tail gecko","Gekkonidae, Gekkota, Sauria, Squamata (lizards: geckos)",19849,"",NULL,"2021-04-30 18:54:00","2021-04-30 18:54:00"
11156,0,"Uropeltis woodmasoni","(THEOBALD 1876)","","E: Woodmason's Earth Snake","Uropeltidae, Henophidia, Alethinophidia, Serpentes, Squamata (snakes)",19848,"",NULL,"2021-04-30 18:54:00","2021-04-30 18:54:00"
11155,0,"Uropeltis shorttii","(BEDDOME 1863)","","E: Shevaroy HilIs Earth Snake","Uropeltidae, Henophidia, Alethinophidia, Serpentes, Squamata (snakes)",19846,"",NULL,"2021-04-30 18:54:00","2021-04-30 18:54:00"
11154,0,"Uropeltis rubromaculata","(BEDDOME 1867)","","E: Red-spotted Earth Snake","Uropeltidae, Henophidia, Alethinophidia, Serpentes, Squamata (snakes)",19844,"",NULL,"2021-04-30 18:54:00","2021-04-30 18:54:00"
11153,0,"Uropeltis rubrolineata","(GÜNTHER 1875)","","E: Red-lined Earth Snake","Uropeltidae, Henophidia, Alethinophidia, Serpentes, Squamata (snakes)",19843,"",NULL,"2021-04-30 18:54:00","2021-04-30 18:54:00"
11152,0,"Uropeltis rajendrani","GANESH & ACHYUTHAN 2020","","E: Rajendran’s Shieldtail snake","Uropeltidae, Henophidia, Alethinophidia, Serpentes, Squamata (snakes)",22620,"",NULL,"2021-04-30 18:54:00","2021-04-30 18:54:00"
11151,0,"Uropeltis pulneyensis","(BEDDOME 1863)","","E: Indian Earth Snake, Palni Shieldtail","Uropeltidae, Henophidia, Alethinophidia, Serpentes, Squamata (snakes)",19842,"",NULL,"2021-04-30 18:54:00","2021-04-30 18:54:00"
11150,0,"Uropeltis phipsonii","(MASON 1888)","","E: Phipson's Shieldtail","Uropeltidae, Henophidia, Alethinophidia, Serpentes, Squamata (snakes)",19841,"",NULL,"2021-04-30 18:54:00","2021-04-30 18:54:00"
11149,0,"Uropeltis petersi","(BEDDOME 1878)","","E: Shieldtail Earth Snake","Uropeltidae, Henophidia, Alethinophidia, Serpentes, Squamata (snakes)",19839,"",NULL,"2021-04-30 18:54:00","2021-04-30 18:54:00"
11148,0,"Uropeltis ocellata","(BEDDOME 1863)","","E: Ocellated Earth Snake, Ocellate Shieldtail","Uropeltidae, Henophidia, Alethinophidia, Serpentes, Squamata (snakes)",19838,"",NULL,"2021-04-30 18:54:00","2021-04-30 18:54:00"
11147,0,"Uropeltis nitida","(BEDDOME 1878)","","E: Southern Earth Snake","Uropeltidae, Henophidia, Alethinophidia, Serpentes, Squamata (snakes)",19837,"",NULL,"2021-04-30 18:54:00","2021-04-30 18:54:00"
11146,0,"Uropeltis myhendrae","(BEDDOME 1886)","","E: Boulenger's Earth Snake","Uropeltidae, Henophidia, Alethinophidia, Serpentes, Squamata (snakes)",19836,"",NULL,"2021-04-30 18:54:00","2021-04-30 18:54:00"
11145,0,"Uropeltis madurensis","(BEDDOME 1878)","","E: Madura Earth Snake","Uropeltidae, Henophidia, Alethinophidia, Serpentes, Squamata (snakes)",19834,"",NULL,"2021-04-30 18:54:00","2021-04-30 18:54:00"
11144,0,"Uropeltis maculata","(BEDDOME 1878)","","E: Spotted Earth Snake","Uropeltidae, Henophidia, Alethinophidia, Serpentes, Squamata (snakes)",19833,"",NULL,"2021-04-30 18:54:00","2021-04-30 18:54:00"
11143,0,"Uropeltis macrorhyncha","(BEDDOME 1877)","","E: Anamally Earth Snake","Uropeltidae, Henophidia, Alethinophidia, Serpentes, Squamata (snakes)",19832,"",NULL,"2021-04-30 18:54:00","2021-04-30 18:54:00"
11142,0,"Uropeltis macrolepis","(PETERS 1862)","Uropeltis macrolepis macrolepis (PETERS 1862)
Uropeltis macrolepis mahableshwarensis CHARI 1955","E: Bombay Earth Snake","Uropeltidae, Henophidia, Alethinophidia, Serpentes, Squamata (snakes)",19831,"",NULL,"2021-04-30 18:54:00","2021-04-30 18:54:00"
11141,0,"Uropeltis liura","(GÜNTHER 1875)","","E: Günther's Earth Snake","Uropeltidae, Henophidia, Alethinophidia, Serpentes, Squamata (snakes)",19830,"",NULL,"2021-04-30 18:54:00","2021-04-30 18:54:00"
11140,0,"Uropeltis grandis","(BEDDOME 1867)","","E: Smith's Earth Snake","Uropeltidae, Henophidia, Alethinophidia, Serpentes, Squamata (snakes)",19847,"",NULL,"2021-04-30 18:54:00","2021-04-30 18:54:00"
11139,0,"Uropeltis ellioti","(GRAY 1858)","","E: Elliot's Earth Snake
G: Rauhschwanzschlange","Uropeltidae, Henophidia, Alethinophidia, Serpentes, Squamata (snakes)",19829,"",NULL,"2021-04-30 18:54:00","2021-04-30 18:54:00"
11138,0,"Uropeltis dindigalensis","(BEDDOME 1877)","","E: Sirumalai Hills Earth Snake","Uropeltidae, Henophidia, Alethinophidia, Serpentes, Squamata (snakes)",19828,"",NULL,"2021-04-30 18:54:00","2021-04-30 18:54:00"
11137,1,"Uropeltis ceylanica","CUVIER 1829","","E: Ceylon Earth Snake","Uropeltidae, Henophidia, Alethinophidia, Serpentes, Squamata (snakes)",19827,"",NULL,"2021-04-30 18:54:00","2021-04-30 18:54:00"
11136,0,"Uropeltis broughami","(BEDDOME 1878)","","E: Brougham's Earth Snake","Uropeltidae, Henophidia, Alethinophidia, Serpentes, Squamata (snakes)",19826,"",NULL,"2021-04-30 18:54:00","2021-04-30 18:54:00"
11135,0,"Uropeltis bicatenata","GÜNTHER 1864","","E: Bicatenate Uropeltis, Two-chained Uropeltis","Uropeltidae, Henophidia, Alethinophidia, Serpentes, Squamata (snakes)",19825,"",NULL,"2021-04-30 18:54:00","2021-04-30 18:54:00"
11134,0,"Uropeltis bhupathyi","JINS, SAMPAIO & GOWER 2018","","E: Bhupathy’s uropeltis or Bhupathy’s shieldtail","Uropeltidae, Henophidia, Alethinophidia, Serpentes, Squamata (snakes)",21506,"",NULL,"2021-04-30 18:54:00","2021-04-30 18:54:00"
11133,0,"Uropeltis beddomii","(GÜNTHER 1862)","","E: Beddome's Earth Snake","Uropeltidae, Henophidia, Alethinophidia, Serpentes, Squamata (snakes)",19824,"",NULL,"2021-04-30 18:54:00","2021-04-30 18:54:00"
11132,0,"Uropeltis arcticeps","(GÜNTHER 1875)","","E: Tirunelveli Earth Snake","Uropeltidae, Henophidia, Alethinophidia, Serpentes, Squamata (snakes)",19823,"",NULL,"2021-04-30 18:54:00","2021-04-30 18:54:00"
11131,0,"Uromastyx yemenensis","WILMS & SCHMITZ 2007","","E: South Arabian Spiny-tailed Lizard
G: Südarabische Dornschwanzagame","Agamidae (Uromastycinae), Sauria, Iguania, Squamata (lizards)",19822,"",NULL,"2021-04-30 18:54:00","2021-04-30 18:54:00"
11130,0,"Uromastyx thomasi","PARKER 1930","","E: Omani Spiny-tailed Lizard, Thomas' Mastigure
G: Oman-Dornschwanzagame","Agamidae (Uromastycinae), Sauria, Iguania, Squamata (lizards)",19821,"",NULL,"2021-04-30 18:54:00","2021-04-30 18:54:00"
11129,0,"Uromastyx shobraki","WILMS & SCHMITZ 2007","","G: Südarabische Dornschwanzagame","Agamidae (Uromastycinae), Sauria, Iguania, Squamata (lizards)",19820,"",NULL,"2021-04-30 18:54:00","2021-04-30 18:54:00"
